{
  "contract": 1,
  "app": "grid",
  "title": "AP inspection activity and data quality",
  "data": {
    "mode": "upload",
    "sources": [
      {
        "id": "ap",
        "type": "parquet",
        "file": "unified_ap.parquet",
        "schema": {
          "source": { "type": "string", "nullable": false },
          "order_number": { "type": "string", "nullable": false },
          "test_station_identifier": { "type": "string", "nullable": false },
          "sequence_number": { "type": "string", "nullable": true },
          "G0003": { "type": "string", "nullable": true },
          "product_mlfb": { "type": "string", "nullable": true },
          "inspection_date": { "type": "timestamp", "nullable": false },
          "is_last_measurement": { "type": "boolean", "nullable": true }
        }
      }
    ]
  },
  "filters": [
    {
      "id": "date",
      "kind": "date-range",
      "source": "ap",
      "column": "inspection_date",
      "default": { "kind": "latest-days", "days": 30 }
    },
    {
      "id": "source",
      "kind": "select",
      "source": "ap",
      "column": "source",
      "default": null
    },
    {
      "id": "station",
      "kind": "select",
      "source": "ap",
      "column": "test_station_identifier",
      "default": null
    },
    {
      "id": "product",
      "kind": "select",
      "source": "ap",
      "column": "product_mlfb",
      "default": null
    },
    {
      "id": "order",
      "kind": "text",
      "source": "ap",
      "column": "order_number",
      "default": null
    }
  ],
  "queries": {
    "summary": {
      "sql": "SELECT count(*) AS records, count(DISTINCT order_number) AS orders, count(DISTINCT product_mlfb) AS products, count(DISTINCT test_station_identifier) AS stations, count(*) FILTER (WHERE G0003 IS NOT NULL) AS code_present, round(100.0 * count(*) FILTER (WHERE G0003 IS NOT NULL) / nullif(count(*), 0), 2) AS code_present_pct, count(*) FILTER (WHERE is_last_measurement = false) AS non_last, round(100.0 * count(*) FILTER (WHERE is_last_measurement = false) / nullif(count(*), 0), 2) AS non_last_pct FROM ap WHERE ($date_from IS NULL OR CAST(inspection_date AS DATE) >= $date_from) AND ($date_to IS NULL OR CAST(inspection_date AS DATE) < $date_to) AND ($source IS NULL OR source = $source) AND ($station IS NULL OR test_station_identifier = $station) AND ($product IS NULL OR product_mlfb = $product) AND ($order IS NULL OR order_number = $order)",
      "params": ["date_from", "date_to", "source", "station", "product", "order"]
    },
    "daily": {
      "sql": "SELECT CAST(CAST(date_trunc('day', inspection_date) AS DATE) AS VARCHAR) AS day, source, count(*) AS records FROM ap WHERE ($date_from IS NULL OR CAST(inspection_date AS DATE) >= $date_from) AND ($date_to IS NULL OR CAST(inspection_date AS DATE) < $date_to) AND ($source IS NULL OR source = $source) AND ($station IS NULL OR test_station_identifier = $station) AND ($product IS NULL OR product_mlfb = $product) AND ($order IS NULL OR order_number = $order) GROUP BY day, source ORDER BY day, source",
      "params": ["date_from", "date_to", "source", "station", "product", "order"]
    },
    "by_station": {
      "sql": "SELECT test_station_identifier AS station, count(*) AS records FROM ap WHERE ($date_from IS NULL OR CAST(inspection_date AS DATE) >= $date_from) AND ($date_to IS NULL OR CAST(inspection_date AS DATE) < $date_to) AND ($source IS NULL OR source = $source) AND ($station IS NULL OR test_station_identifier = $station) AND ($product IS NULL OR product_mlfb = $product) AND ($order IS NULL OR order_number = $order) GROUP BY station ORDER BY records DESC, station",
      "params": ["date_from", "date_to", "source", "station", "product", "order"]
    },
    "top_products": {
      "sql": "WITH grouped AS (SELECT product_mlfb, count(*) AS records FROM ap WHERE ($date_from IS NULL OR CAST(inspection_date AS DATE) >= $date_from) AND ($date_to IS NULL OR CAST(inspection_date AS DATE) < $date_to) AND ($source IS NULL OR source = $source) AND ($station IS NULL OR test_station_identifier = $station) AND ($product IS NULL OR product_mlfb = $product) AND ($order IS NULL OR order_number = $order) GROUP BY product_mlfb), ranked AS (SELECT product_mlfb, records, row_number() OVER (ORDER BY records DESC, product_mlfb NULLS LAST) AS rn FROM grouped), bucketed AS (SELECT CASE WHEN rn <= 10 THEN COALESCE(product_mlfb, '(missing product)') ELSE 'Other products' END AS product, records FROM ranked) SELECT product, CAST(sum(records) AS BIGINT) AS records FROM bucketed GROUP BY product ORDER BY records DESC, product",
      "params": ["date_from", "date_to", "source", "station", "product", "order"]
    },
    "g0003_codes": {
      "sql": "SELECT G0003 AS code, count(*) AS records FROM ap WHERE G0003 IS NOT NULL AND ($date_from IS NULL OR CAST(inspection_date AS DATE) >= $date_from) AND ($date_to IS NULL OR CAST(inspection_date AS DATE) < $date_to) AND ($source IS NULL OR source = $source) AND ($station IS NULL OR test_station_identifier = $station) AND ($product IS NULL OR product_mlfb = $product) AND ($order IS NULL OR order_number = $order) GROUP BY code ORDER BY records DESC, code",
      "params": ["date_from", "date_to", "source", "station", "product", "order"]
    },
    "station_day": {
      "sql": "SELECT CAST(CAST(date_trunc('day', inspection_date) AS DATE) AS VARCHAR) AS day, test_station_identifier AS station, count(*) AS records FROM ap WHERE ($date_from IS NULL OR CAST(inspection_date AS DATE) >= $date_from) AND ($date_to IS NULL OR CAST(inspection_date AS DATE) < $date_to) AND ($source IS NULL OR source = $source) AND ($station IS NULL OR test_station_identifier = $station) AND ($product IS NULL OR product_mlfb = $product) AND ($order IS NULL OR order_number = $order) GROUP BY day, station ORDER BY day, station",
      "params": ["date_from", "date_to", "source", "station", "product", "order"]
    },
    "recent_records": {
      "sql": "SELECT CAST(inspection_date AS VARCHAR) AS inspection_date, order_number, product_mlfb, test_station_identifier, source, sequence_number, G0003, is_last_measurement FROM ap WHERE ($date_from IS NULL OR CAST(inspection_date AS DATE) >= $date_from) AND ($date_to IS NULL OR CAST(inspection_date AS DATE) < $date_to) AND ($source IS NULL OR source = $source) AND ($station IS NULL OR test_station_identifier = $station) AND ($product IS NULL OR product_mlfb = $product) AND ($order IS NULL OR order_number = $order) ORDER BY inspection_date DESC, order_number, sequence_number NULLS LAST",
      "params": ["date_from", "date_to", "source", "station", "product", "order"]
    }
  },
  "layout": [
    { "id": "kpi_records", "type": "kpi", "query": "summary", "field": "records", "label": "Inspection records" },
    { "id": "kpi_orders", "type": "kpi", "query": "summary", "field": "orders", "label": "Distinct orders" },
    { "id": "kpi_products", "type": "kpi", "query": "summary", "field": "products", "label": "Distinct products" },
    { "id": "kpi_stations", "type": "kpi", "query": "summary", "field": "stations", "label": "Active stations" },
    { "id": "kpi_code", "type": "kpi", "query": "summary", "field": "code_present", "label": "Records with a G0003 code" },
    { "id": "kpi_code_pct", "type": "kpi", "query": "summary", "field": "code_present_pct", "label": "G0003 presence (%)", "decimals": 2 },
    { "id": "kpi_non_last", "type": "kpi", "query": "summary", "field": "non_last", "label": "Records not marked as last measurement" },
    { "id": "kpi_non_last_pct", "type": "kpi", "query": "summary", "field": "non_last_pct", "label": "Not marked as last measurement (%)", "decimals": 2 },
    { "id": "daily_volume", "type": "line", "query": "daily", "x": "day", "y": "records", "series": "source", "label": "Daily inspection record volume by source", "annotations": [{ "at": "2023-11-22", "label": "ap1 to ap2 source transition" }] },
    { "id": "station_activity", "type": "bar", "query": "by_station", "x": "station", "y": "records", "orientation": "horizontal", "label": "Station activity (inspection records)" },
    { "id": "top_products_chart", "type": "bar", "query": "top_products", "x": "product", "y": "records", "label": "Top product MLFBs by inspection record count" },
    { "id": "g0003_frequency", "type": "bar", "query": "g0003_codes", "x": "code", "y": "records", "label": "G0003 frequency among non-null codes" },
    { "id": "station_day_heatmap", "type": "heatmap", "query": "station_day", "x": "day", "y": "station", "value": "records", "label": "Station activity by day (inspection records)" },
    { "id": "recent_records", "type": "table", "query": "recent_records", "label": "Filtered inspection records", "columns": [
      { "field": "inspection_date", "label": "Inspection date" },
      { "field": "order_number", "label": "Order" },
      { "field": "product_mlfb", "label": "Product MLFB" },
      { "field": "test_station_identifier", "label": "Station" },
      { "field": "source", "label": "Source" },
      { "field": "sequence_number", "label": "Sequence" },
      { "field": "G0003", "label": "G0003" },
      { "field": "is_last_measurement", "label": "Last measurement" }
    ] }
  ]
}
