{
  "contract": 1,
  "app": "grid",
  "title": "AP inspection records",
  "data": {
    "mode": "upload",
    "sources": [
      {
        "id": "ap",
        "type": "json",
        "file": "ap.json",
        "schema": {
          "station": { "type": "string", "nullable": false }
        }
      }
    ]
  },
  "filters": [],
  "queries": {
    "summary": {
      "sql": "SELECT count(*) AS records FROM ap",
      "params": []
    }
  },
  "layout": [
    {
      "id": "records",
      "type": "kpi",
      "query": "summary",
      "field": "records",
      "label": "Inspection records"
    }
  ]
}
